<?xml version="1.0" encoding="UTF-8"?>
<tns:configuration xmlns:tns="http://www.dabi.com/habitv/configuration/entities" xmlns:xsi="http://www.w3.org/2001/XMLSchema-instance" xsi:schemaLocation="http://www.dabi.com/habitv/configuration/entities configuration.xsd ">
  <proxies>
    <proxy>
      <protocol>protocol</protocol>
      <host>host</host>
      <port>0</port>
      <pluginSupport>
        <plugin>plugin</plugin>
      </pluginSupport>
    </proxy>
  </proxies>
  <osConfig>
    <cmdProcessor>cmdProcessor</cmdProcessor>
  </osConfig>
  <downloadConfig>
    <downloadOuput>downloadOuput</downloadOuput>
    <maxAttempts>0</maxAttempts>
    <demonCheckTime>0</demonCheckTime>
    <fileNameCutSize>0</fileNameCutSize>
    <downloaders/>
  </downloadConfig>
  <updateConfig>
    <updateOnStartup>true</updateOnStartup>
    <autoriseSnapshot>true</autoriseSnapshot>
  </updateConfig>
  <exportConfig>
    <exporters>
      <exporter>
        <condition>
          <reference>reference</reference>
          <pattern>pattern</pattern>
        </condition>
        <id>id</id>
        <label>label</label>
        <command>command</command>
        <subexporters/>
      </exporter>
    </exporters>
  </exportConfig>
  <taskDefinition/>
</tns:configuration>
